{
  "protocol_version": "1.0",
  "run_id": "run_status_examples_expanded_01",
  "agent_id": "agent-server-01",
  "agent": "executor",
  "status": "blocked",
  "created_at": "2026-03-17T15:10:45Z",
  "updated_at": "2026-03-17T15:28:30Z",
  "task_id": "task-local-server-smoke",
  "batch_id": "b-server",
  "attempt": 1,
  "started_at": "2026-03-17T15:11:00Z",
  "completed_at": "2026-03-17T15:27:45Z",
  "last_heartbeat_at": "2026-03-17T15:27:30Z",
  "resource_class": "server",
  "resource_status": "cleanup_failed",
  "teardown_required": true,
  "resource_handles": {
    "pid": 4512,
    "port": 4173,
    "process_label": "preview-server",
    "url": "http://127.0.0.1:4173"
  },
  "cleanup_status": "failed",
  "result_summary": "The smoke test passed, but the local server could not be confirmed stopped.",
  "evidence_refs": [
    "logs/server-smoke.log",
    "logs/server-cleanup.log"
  ],
  "error": "Server child process kept listening on port 4173 after teardown."
}
